### ISSUE TITLE
check_ping fails when testing a particular host (update2.stormshield.eu)

### ISSUE THREAD

**Issue by linuxacastano** [nagios-plugins/nagios-plugins#230]
This has been tested on two different environments and it seems easy to reproduce:

`nagios@srv:~$` /usr/lib/nagios/plugins/check_ping -H update2.stormshield.eu -w 5000,100% -c 5000,100% -p 1
**CRITICAL - Network Unreachable `(update2.stormshield.eu)**`

When trying from another nagios server, I have the same issue:

`root@acastano` ~ # /usr/lib/nagios/plugins/check_ping -H update2.stormshield.eu -w 5000,100% -c 5000,100% -p 1
**CRITICAL - Destination Unreachable `(update2.stormshield.eu)**`

Creating a host on /etc/hosts called update2.stormshield.eu I have the same output.

I have made a network dump to see if the dns request is sent:

`tcpdump:` verbose output suppressed, use -v or -vv for full protocol decode
listening on eth0, link-type EN10MB (Ethernet), capture size 65535 bytes
16:57:11.678021 IP 10.0.0.30.43240 > 10.0.0.1.53: 23838+ A? update2.stormshield.eu. (40)
16:57:11.678094 IP 10.0.0.30.43240 > 10.0.0.1.53: 55043+ AAAA? update2.stormshield.eu. (40)
16:57:11.680745 IP 10.0.0.1.53 > 10.0.0.30.43240: 23838 1/0/0 A 94.23.230.70 `(56)`

So, I suspect a problem on the check_ping plugin. Do not hesitate to ask the nagios configuration or other elements you will need to debug it.

**Comment by jfrickson** [comment]
It looks like a problem with their IPv6 address. If I add `-4` it works fine.

```
$ /usr/local/nagios/lib/check_ping -H update2.stormshield.eu -w 5000,100% -c 5000,100% -p 1 -4
PING OK - Packet loss = 0%, RTA = 142.12 ms|rta=142.121002ms;5000.000000;5000.000000;0.000000 pl=0%;100;100;0

$ nslookup
> set type=any
> update2.stormshield.eu
Server:         192.168.5.2
Address:        192.168.5.2#53

Non-authoritative answer:
update2.stormshield.eu  has AAAA address 2001:41d0:2:6946::1
Name:   update2.stormshield.eu
Address: 94.23.230.70
> exit

$ ping -c1 94.23.230.70
PING 94.23.230.70 (94.23.230.70) 56(84) bytes of data.
64 bytes from 94.23.230.70: icmp_seq=1 ttl=48 time=117 ms

--- 94.23.230.70 ping statistics ---
1 packets transmitted, 1 received, 0% packet loss, time 0ms
rtt min/avg/max/mdev = 117.070/117.070/117.070/0.000 ms

$ ping6 2001:41d0:2:6946::1
connect: Network is unreachable
```
